{
  "version": "1.0.0",
  "messageId": "host-render-001",
  "replyTo": "ui-context-request-001",
  "timestamp": "2026-03-21T20:45:01+08:00",
  "kitId": "chat-auto-reply",
  "surface": "panel",
  "source": "host-adapter",
  "target": "function-kit-ui",
  "type": "candidates.render",
  "payload": {
    "requestContext": {
      "sourceMessage": "今晚方便把方案发我吗？",
      "personaChips": [
        "同事沟通",
        "明确时间",
        "简洁"
      ],
      "conversationSummary": "对方在追要方案，希望今晚同步。"
    },
    "result": {
      "candidates": [
        {
          "id": "candidate-1",
          "text": "可以，我今晚 9 点前整理好发你。",
          "tone": "professional-friendly",
          "risk": "low",
          "rationale": "给出明确时间，适合同事协作场景。",
          "actions": [
            {
              "type": "insert",
              "label": "插入"
            }
          ]
        },
        {
          "id": "candidate-2",
          "text": "方便，我还在收尾，今晚整理完第一时间发你。",
          "tone": "professional-friendly",
          "risk": "medium",
          "rationale": "语气更柔和，但时间不够具体。",
          "actions": [
            {
              "type": "insert",
              "label": "插入"
            },
            {
              "type": "regenerate",
              "label": "换一批"
            }
          ]
        },
        {
          "id": "candidate-3",
          "text": "可以，我再核一下细节，今晚确认后发你。",
          "tone": "professional-friendly",
          "risk": "low",
          "rationale": "避免过度承诺，保留确认空间。",
          "actions": [
            {
              "type": "insert",
              "label": "插入"
            }
          ]
        }
      ],
      "missing_context": []
    },
    "uiHints": {
      "allowRegenerate": true,
      "emptyStateLabel": "暂无候选"
    }
  }
}
